question,answer,Declarative_Text
"Right. You don't dispute that the on j May 1st, 1963, that R.J. Reynolds wrote to the Geiger School in Tacoma, Washington, right? | j","I'm not disputing it, no. If you want ~ want j to show me the letter I'll be happy to look at it. j",
Sure. \,I got two copies. j I,
Okay. j,"So, again, this would be -- Geiger School j Ol en United Reporting, Inc. Source: https://www.industrydocuments.ucsf.edu/docs/rspw0221 wrote Reynolds at some point, said that they were doing some search project.",
Right. R.J. Reynolds Tobacco Company took the step of actually writing a letter to a group of fourth %J L J J L C l > v - v * J L O J L I I J L Z / \ J J v - - \ J x . X . % 3 . V ^ L,"Right. Because they were solicited to do so. So, I mean -- I mean, this is you know, every time -- the school letters that I've seen it's been the school has solicited a response from Reynolds and Reynolds has replied. And basically states what their position is at that given point in time.",
"It would not be unreasonable for R.J. Reynolds to believe that this letter was actually read to the fourth grade class, right?",I have I have no reason to know if it did or it didn't.,
"Right. But when they're writing a letter to to a class a class a fourth grade class, it would be reasonable for them to assume that the letter was actually read to the class?","It's possible, yeah.",
"Right. And so they're telling them that despite many years of extensive research, medical science has been unable to establish that smoking has a wssjsniwHWBawrawwsTO?! ^ CO Ol * O l United Reporting, Inc. Source: https://www.industrydocuments.ucsf.edu/docs/rspw0221 direct causal link with any human disease; that's what they told the class, right?",Correct.,
That's what they told fourth graders in 1963?,Correct.,
"Well, they didn't in theory tell them that; they actually wrote it, right?",That's what they wrote.,
"So when we were talking earlier about clearly these examples that we went through over the course of i y many oecaoes, tns ous, Tine /us, nne ous/ ano tns '90s, correct?","'90, but yes. In general. But that doesn't necessarily mean that the position is not complex.",
"Now, it's the position of R.J. Reynolds that R.J. Reynolds has never gone after new smokers, correct?",I don't know.,
Is it your position that R.J.,,
"Okay. Dr. Figlar, you agree that given what the R.J. Reynolds Tobacco Company knew in the 1980s that I it would be wrong to market to new young smokers, correct?",,
"You understand, Dr. Figlar, that over the course of many decades various executives of the companies have been in positions where they talk about en United Reporting, Inc. Source: https://www.industrydocuments.ucsf.edu/docs/rspw0221 cigarettes and whether or not there's any proof that ** Vv* i^ VHJ C I Am w L* L* w w \w G L4 * J C* u -X. iZ? Vu>> G O C vw Vu' X< .X* \Z* Vn> w Xli ^V 'G* V*** Ll w X V sZ. O v^ Am L# X X C companies.","There have been from time to time, yes.",
"There have been executives of the R.J. Reynolds Tobacco Company, Brown & Williamson, and American Tobacco who have done that, correct?","From time to time, yes.",
And you're familiar with Robert Heimann?,"I know I know of Heimann, yes.",
Okay. You're familiar with the deposition that he gave in the Horton case back in 1986?,"I am, yes.",
Okay. And who is Robert Heimann?,He was an executive at American Tobacco.,
"He was actually at one point the Chief x i Hixecutive or Amsricdn j.o.oacco, correct..","I believe that is correct, yes.",
"And in the Heimann in the 1986 Horton deposition he was speaking on behalf of the American Tobacco Company, correct?","I believe he was already retired but I believe he was speaking on behalf of them, yes. * l i^J x""\din, wb Am mLn *] XX 'LIT / i i XKJL y v*J \Ji V C5 fcU \w? \L+ XX Km* XX \m+ Km* A . C L X X h3 *'X. -X. f ^ L* 5 * % regarding his testimony, right? | 4s. en United Reporting, Inc. S*JVHj4mt*J 4*4*4* I Source: https://www.industrydocuments.ucsf.edu/docs/rspw0221",
"Okay. You're familiar with this line of question and answers and correct me if I'm wrong I want to talk to you just a minute about the position of American Tobacco Company. At the time you first went to work for American Tobacco Company had they already taken a position that smoking on smoking and health to the effect that cigarettes were not injurious to your health? iz An swer* es. Had they taken that position? Is that a position that they maintained throughout your employment with American Tobacco? Answer: Yes. Would it be correct, then, from 1954 until 1980 -- which is approximately the time that he left the company, you understand that, right?","Roughly, yes.",
"Okay. He's speaking on behalf of he's speaking about the company from the time that he was there, correct? f co i N","Correct. i ro I o> United Reporting, Inc. Source: https://www.industrydocuments.ucsf.edu/docs/rspw0221",
"So would it be correct, then, from 1954 until 1980 it was American Tobacco's position that cigarettes are not injurious to your health? Answer: That is so. That's what he said, right?",Correct.,
"At the time that that position was formulated in 1954 based upon your information, who formulated that position for American Tobacco? U Answer: The rormulator and spokesman was the ii c h 1 pf pxpcut"" i V P o""F""f""""i/p>f* o ir i_ u. , omiT) snu Mr Paul Hahn That's what he said, correct?",I believe that's correct,
"Question: Would you expect a consumer to rely upon your advertisements? Answer: Yes, our advertising is truthful. And we anticipate that they would rely on it if they chose? Certainly. Thatfs what he said, right?","I believe that's correct, yes.",
"And you agree with that, right? j g ZD A I dO . i jv J <*"" t ai I to United Reporting, Inc. Source: https://www.industrydocuments.ucsf.edu/docs/rspw0221",,
"And you agree with that as it relates to R.J. Reynolds as well, right?","I would, yes.",
"And that's the sort Question: That's the sort of -- strike that. Question: That's sort of a promise for the consumer to expect from your product? Answer: Yes, I'm sure it is. That's what he said, right?",It is.,
And you agree that the same would be true for R.J. Reynolds advertisements?,,
Correct?,"In general, yes.",
"Okay. Throughout your tender -- strike that. Throughout your tenure with the American Tobacco Company, it was not only American's position but your position that cigarettes were not injurious to health; is that correct? Answer: Through my tenure? * JL *^J \JL \* W Lr* l~ *-S J- JL -i VtZ ha} * Answer: Yes, that is so. Question: That's something American wanted the public to believe; is that correct? i en Answer: Yes. j ""t I I en ^__________ I to United Reporting, Inc. Source: https://www.industrydocuments.ucsf.edu/docs/rspw0221 j. i n a L s wnan ne was asKeoi ano LIIQL S wnan ne said, correct?","I would say so, yes.",
"And the same -- and you the same would be true for Reynolds, correct?","I mean, I I don't I don't know whether or not a Reynolds' executive would have said the exact same type of thing, but in general I can say the Reynolds' executive would have said we believe our positions and we would believe that consumers have the right to know them and to believe them.",
"Right. Question: Is that a statement American Tobacco placed great reliance on? Answer: We issued that statement, yes. Certainly we wanted them to believe. M \^ H 3 T G T*J r""l ^3 I n Zb O ^3 ""1 / \ (** /*\ T1* ""V* C^ i*1 T"""" r o l l l a L s w n a L iitr acLXvl, L*\Jx. x. c\* l~ I","He did, yes.",
"And based on what you know about R.J. Reynolds, R.J. Reynolds felt -- would have felt the same way, that they would have wanted the American public to believe the statements that they made?","I would think so, yes.",
"As far as you're concerned, a person is 'WSWMBWSSWWiWBMWMWM^^ I e n I r\> United Reporting, Inc. Source: https://www.industrydocuments.ucsf.edu/docs/rspw0221 justified in relying on that statement? rill owe? J. ico . That's what he said, right?",He did.,
And the same would be true for R.J. Reynolds?,"In general, yes.",
"No reason you know of why the public couldn't accept your company's position, is there? Answer: Well, in the area of scientific integrity, I know of no reason why they should not accept our position. That's what he said, correct?",I believe so.,
"And you believe the same would be true as it relates to the R.J. Reynolds Tobacco Company's position that they took, correct?","I would, yes.",
"Question: Would you blame a person for smoking two packs a day? Would you? Answer: No. You wouldn't fault him for smoking one pack or two packs; is that correct? I think so. <i inat s wnat ne saia, ngnx.'","Yes. W J M M W M W M ^ I I U I ^ W ""Nl O) United Repotting, Inc. Source: https://www.industrydocuments.ucsf.edu/docs/rspw0221",
"On behalf of the American Tobacco Company, corrects","In answer to those questions, yeah.",
"And as a representative of R.J. Reynolds, you","As to whether or not I blame somebody for smoking one or two packs of cigarettes? I mean, it's their choice. It's the consumers' choice on how much they smoke, so, no, I wouldn't.",
"As far as you're concerned, is the Surgeon General simply wrong in concluding that cigarette smoking causes lung cancer? Answer: I would use the term misguided. That was the question he was asked and that was the answer he gave, correct?","It is, yes. -L */ Vj^/ Xi \Z* \H* CL L -L tm* sJl L* 11 vZ- O LA X. \*A sZ- \J 11 \3 sl 11 \Z* X- Ct JL l L L J L o s J U J L \Ji si* sJl correct?",
"He said that on behalf of the American Tobacco Company, correct?",,
"And if he is misguided Question: And if he is misguided, then I take ^j ,L L. L, 11 CL L V \J Li 1 w k-r 1* 11 X, \J 11 X D 11 w <J* O W JL w 11 y Answer: I was simply trying to be polite *mJ C % Aw* Via* \ A w -IL Lu- about it, in your opinion, he is wrong? Answer: Dead wrong. That's what he said, right?","He did, yes.",
"Okay. And the opinion of the R.J. Reynolds Tobacco Company at the time was also that the Surgeon ij uGnsrdi was wrong, correct!.","I don't know that we would have necessarily had that opinion. We did not have the same view of what science told us, that's for sure.",
"Now, did the R.J. Reynolds Tobacco Company take advice from their legal department with regards to the subjects that they investigated from a scientific standpoint related to their cigarette products?",I -- I don't know. I don't know -- I don't know what you mean by that question.,
"You're familiar with Exhibit 11, right?","In general I am, yes. CO cn United Reporting, Inc. Source: https://www.industrydocuments.ucsf.edu/docs/rspw0221 PRIVILEGED MATERIAL REDACTED WnWK^VtWM^WRM*WMKWWMWAWAW.V KWXWWW^'LWPWWrcTOWrW^^ h U J ^ U ! ^ > 4 ' r a ? W ? W ^ ^ United Reporting, inc. Source: https://www.industrydocuments.ucsf.edu/docs/rspw0221 United Reporting, Inc. Source: https://www.industrydocuments.ucsf.edu/docs/rspw0221 PRIVILEGED MATERIAL REDACTED W^V&IJ^WWWIW^ United Reporting, Inc. Source: https://www.industrydocuments.ucsf.edu/docs/rspw0221 United Reporting, Inc. Source: https://www.industrydocuments.ucsf.edu/docs/rspw0221 PRIVILEGED MATERIAL REDACTED United Reporting, Inc. Source: https://www.industrydocuments.ucsf.edu/docs/rspw0221 pR |V |L EQE D M A J E R | A | _ R E D A Q J E D Page 278 f",
I'll show you Plaintiffs' Exhibit 12. Are you o ramiiiar winn unis ctocuiusnt.,Let me just I believe I saw this in preparation for this deposition.,
What's the date of this?,June of 1969.,
Okay. And this is a Brown & Williamson document?,"I is it Brown & Williamson or American, I can't remember which. It could it could be. It must be. Yes, this must be a Brown & Williamson document, because it's London, so it would be to BAT, so I believe it's Brown & Williamson.",
You believe this to be an authentic business record of Brown & Williamson?,I have no reason to dispute it.,
What is Compound W?,I believe that would be nicotine. I think that that is their code name for nicotine.,
Why would they need a code name for nicotine?,"I have no idea since it's so easily deciphered, it seems pretty silly to me.",
"Right, exactly. Were you able to determine in any of the business records that you reviewed why Brown WWMMWMWM^lffBMMMWMWMIt^^ I en I Oi United Reporting, Inc. Source: https://www.industrydocuments.ucsf.edu/docs/rspw0221 & Williamson would feel the need to code the word nicotine as Compound W?","I don't. And I don't understand it. I mean, obviously I've seen these documents this type of document before with this Compound W business, I've never understood it.",
Have you ever seen a document for Brown & Williamson in which there was an instruction that the that the term nicotine would not be used and Compound W would be used in its place?,"I mean, I think I have seen that document. I thought you were asking me why they would do that. I don't -- I'm not aware of why they would have done that.",
You don't think they might have been concerned about other people seeing the documents in the future?,"Well, you know, I don't know whether they were JLr O i riOT!-/ JD Ll L. * -L ITIS cL i l / _L TL 5 IX* 5 S O 6 cL S X X y decipherable. I mean, it makes virtually no sense to me.",
"I didn't say they were smart, I just said that they were trying to conceal the term, correct?",,
"7\ T H r t t i ' t* T m e a n ""it"" h a Q + /> Vsca o*f f a p t i \ r o *i H~ J t\ J. VJ.VJ11 L. J. 1LLC70L11, _L U l i d o L. \J U C C 1 1 C L L . 1 V C 1 you're going to conceal something and this was just to me so silly. .WMTOMWMWIWIW^ * oo United Reporting, Inc. Source: https://www.industrydocuments.ucsf.edu/docs/rspw0221",,
Right .,I don't know why they did it.,
"You ve seen this before, right? _/ A i8Sf 1 u3V6 i",,
"Okay. It's dated May 24, 1971?",,
And it's written by A.H. Laurene to Dr. Murray Senkus?,Correct. R.J. Reynolds?,
And what is it called?,Possible IBT projects.,
What does IBT stand for?,I believe that is Industrial Biotech.,
That's a -- was a division of the company?,No.,
What's Industrial Biotech?,"It was a third party where animal studies were ""^BBWBWHSMSBW^^ $ Co j X } cn | (V) United Reporting, Inc. Source: https://www.industrydocuments.ucsf.edu/docs/rspw0221 contracted.",
Okay. To incorporate -- to study potential designs to incorporate into cigarette products?,"Typically, no. I mean, most of the IBT stuff that I know that was done was to go out to do animal studies on tobacco products.",
Right. In connection with understanding and maybe developing new designs of a product or --,"Mostly to try to get methodologies developed that would be reliable animal models that one could utilize as opposed to but, I mean, ultimately that would be the end, if you had a good animal model you could test designs, but until you get a reliable animal model it's difficult to test designs.",
"As a result of discussions with Dr. Teague and with Section Heads, the following are suggested as possible IBT undertakings.",Uh-huh.,
Dr. Teague was a scientist in the company?,"He was, yes.",
"A respected scientist in the company, correct? zz i\ riL tiiis rime, yes.",,
Was he fired or something?,No.,
"And you're not aware of him ever being United Reporting, Inc. I CO CO Source: https://www.industrydocuments.ucsf.edu/docs/rspw0221 reprimanded for any of the positions that he took, correct?",Reprimanded?,
Yes.,"Not tnat J. rn. aware or, no.",
Sanctioned or punished for any of the positions that he took in any of the memorandums that you've seen?,"No. Not that I'm aware of. I do know where he ended up in his career which was the head of R&D administration where he, you know, kind of made sure of pens and ashtrays and stuff. I mean, that's how he that's where he was when he retired.",
But he was a scientist and conducted JL v? O w -JL xlT * I L* JL JL JL L* X. \Z> O v* CX J_ w I I X*. \J X. JL\ * KJ L\ w V 1 I \*J JL \Jk \3 j \-* w X. ~L CU w t-,"Early on he did, yes. In the '50s I would say that would be true.",
"Well, they're obviously implementing his --","At this time ~ I'm sorry, but at this time he was reporting directly to Murray Senkus as his assistant, so I don't know that he was doing research at that time.",
"Okay. So he's actually under he's directly under the director of Research & Development, Ol CO I to CD United Report ing, Inc. Source: https://www.industrydocuments.ucsf.edu/docs/rspw0221 Dr. Senkus?","He reported to him, yes.",
"Right. And they are discussing with the head of Research & Development, Dr. Senkus, the programs that Dr. league is suggesting that they work on, correct?","Well, the Section Heads and with Dr. Teague.",
Exactly. Right. Those are Dr. league's projects that they are suggesting that they work on?,"Well, I can't differentiate between which ones are Dr. league's and which ones are the Section Heads. Because it says Dr. Teague with Section Heads.",
Okay. But will you,That's all I'm saying.,
Right.,He was part of a meeting.,
"Right. And based on his input and the Section Heads these six things R.J. Reynolds wants to look into closer, correct?","Yes. I mean, to what end I don't necessarily know, but, yes. These are -- these are the six things that came out of some meeting.",
"Number 1 is pH in mouth in response to Turkish smoke, burley smoke, and various components, for example, ammonia, nicotine and etc.","Uh-huh. 'jffWSWSW&li(IWJW^ CO i L I. O l I TO <x> Cn United Repotting, Inc. Source: https://www.industrydocuments.ucsf.edu/docs/rspw0221",
"Using ammonia or nicotine to strike that. Absorption -- number two is absorption of nicotine in the mouth versus the lungs, blood levels, urine levels?","Correct, yes.",
"Difference in nicotine impact from free nicotine and bound nicotine; effect of pH of smoke, blood levels, urine levels and smoking tests, correct?","Correct, yes.",
"Number four, habituating level of nicotine, in parentheses, how low can we go, end parentheses. Referring to the level of nicotine, right?",,
"Referring to the habituating level of m r^of* i D P p n r T P P t"" *?","i l JL, Vw# W I * U ir A V ^ V** V** X , J- <W VM* k*>",
"So 1971, R.J. Reynolds Tobacco Company is considering running tests on trying to determine how low they can go to maintain the habituating level of nicotine, correct?","That is what is suggested here, yes.",
"Number five, what factors important to mouth moistness, menthol, salivating agents, humectants, coating agents, etc., right?","What factors are important to mouth moistness, yes, that's correct. WimWMMMII lUUU^^ f. O l CO *NJ I ro United Reporting, Inc. Source: https://www.industrydocuments.ucsf.edu/docs/rspw0221 of tar, mouth, airways, etc. Tar is the product of tobacco smoke, correct?",
"Yeah, okay. So in 1971 when you're when you're considering you're recognizing that there's -- nicotine causes habituation?","That's exactly what Surgeon General said in '64, correct, and that's what -- Reynolds apparently agrees with that, yes.",
"That's okay. When you're talking about nicotine being habituating, the R.J. Reynolds Tobacco Company is trying to figure out how low they can go in order to continue to maintain that habituating level, right?",That was the suggested research. I don't know that they were successful in making that determination however. right?,
"Right. And you haven't seen anything to 'IjBWMIIIiBBWWB ; CO \ cn i United Reporting, Inc. Source: https://www.industrydocuments.ucsf.edu/docs/rspw0221 suggest that they weren't interested in looking at that, |","Well, actually, I haven't seen any follow-up research that would have been done in that area. But, I mean, how interesting how interested were they if they did or didn't do the studies?",
It's your -- it's your testimony that R.J. Reynolds Tobacco Company was not interested in how habituating nicotine was?,"I'm not saying they weren't interested. I'm just saying, I don't I don't recall seeing the the follow-up studies where they would have done the work.",
"You've seen documents which talk about how nicotine in your cigarette products delivers a kick to the smoker, correct? Quote/unquote, kick.","I'm familiar with the term, yes.",
All right. (Plaintiffs' Exhibit No. 14 marked for identification.),,
"Now, you've seen Plaintiffs' Exhibit 14, right?","I have, yes.",
"What's the date of this document? fflWBMMMWMUMWM)! cn i. """"J m CD United Reporting, Inc. Source: https://www.industrydocuments.ucsf.edu/docs/rspw0221",,
And who is Frank Colby?,Frank Colby was the head of the library at R.J. Reynolds and a scientist.,
"He's a scientist at R.J. Reynolds, right?",He was. But he did found and was in charge of the library and information. v ou you re saying ne was a norarianr,
"Right. Do you know if Frank Colby, this librarian, was ever designated by the R.J. Reynolds Tobacco Company as the person with most knowledge in the company regarding smoking and health?",He was. I'm not saying he was just a librarian. I said he was a scientist and he was certainly an important scientist at the company for years.,
Right. You're familiar with the depositions that he has given?,"I am not, actually. I think I've -- I don't know that I've did you I don't think you gave a I may have seen some. Did you -- I may have read one in preparation for this. I don't think I",
"A deposition where he was designated as the person with the most knowledge at R.J. Reynolds Tobacco Company with regards to the knowledge of smoking and WWMBIMBWWBIIWBMWMMIW^^ S CO I OD United Reporting, Inc. Source: https://www.industrydocuments.ucsf.edu/docs/rspw0221 health?","No, I don't know that I've read a Frank Colby deposition or not. designated by R.J. Reynolds in the 1980s to be the person with the most knowledge in the company the entire company related to the issues of smoking and health?",
"Right. And that's - this document is authored by Frank Colby, right?","It is, yes.",
And does it talk about nicotine and how nicotine affects the smoker?,"Vaguely it does, yeah.",
Okay.,"But not I mean, it doesn't actually I take that back. Because it talks it doesn't really talk about how nicotine affects the smoker. Where where are we reading at?",
All right. Let's look.,"Just show me what you're 24 Q These cigarettes these cigarettes have the I i -A following three main characteristics as distinguished | 4* I en IV) l (D United Reporting, Inc. Source: https://www.industrydocuments.ucsf.edu/docs/rspw0221 from today's cigarettes: They deliver more flavor, they deliver more enjoyment or kicks, quote parentheses, nicotine, closed parentheses. You see that?",
"They deliver more puffs/ at least 20 percent more. A fringe benefit which may or may not be promotable, such as such a cigarette would develop a much less percentage of side stream smoke compared to today's cigarette, right?",Okay. Yeah.,
All right. So you don't agree that they're ref errincr to how nicotine effects the smoker,"Well, I mean, it says he's talking about cigarettes that are made in the 1950s, okay. So those designs would have delivered more tar and more nicotine ana that s what he s talking about, and then more purrs.",
Right.,So I don't know how where we're talking about affects the smoker.,
"Okay. Let's go down to the bottom, then.",Okay.,
"In my judgment for public relations reasons it would be impossible to go all the way back to the 1955-type cigarettes as far as tar and nicotine and the smoke are concerned. I believe it should be possible to \ Ol United Reporting, Inc. Source: https://www.industrydocuments.ucsf.edu/docs/rspw0221 achieve the desired effect by going to a tar level of today's Pall Mall nonfilter type of about 29 milligrams in tar and 1.8 milligrams of nicotine. Still with an old style filter, any desired additional nicotine, quote, kick, end quote, could be easily obtained through pH regulation. Did I read that correctly?","You did, yes.",
"Okay. So Dr. Colby is talking about a very / hm/X. \Z* iu -X. *-J vT* JL LL KHHr CX t!7 LX X- w XLLCr 1 1 L> \~s X . CX v*** X X JL vT* V JL X X * - j CX V** V** J*. L* CX JL X X CXX IL v* LX 1 1 L Vw' JL L* CX L and a certain amount of nicotine in a cigarette, right?","Well, he's talking about what Pall Mall nonfilter yields, yes.",
"Well, he's saying that that that that can be achieved, correct? That precise level?","In general it could, yes. I mean, you could certainly design a cigarette to 29 milligrams of tar.",
And 1.8 milligrams of nicotine?,"Well, I mean, you can probably get close. YoaVi X moar i ./ l e a n , x niccni",
You can get real close?,"I don't know about -- what you mean by real close? I mean, it depends on what blend you use as to how close you're going to get it. ! en",
Right. j Jj,"You know, that's you design cigarettes to E United Reporting, Inc. Source: https://www.industrydocuments.ucsf.edu/docs/rspw0221 yield a tar level and then the percentage of nicotine in a blend is going to tell you how much nicotine you would get.",
Okay. And that's something that you can that R.J. Reynolds can control?,"I mean, not really. I mean, we don't control that. We can we certainly understand the mixing and we can measure how much nicotine's in the tobacco, and we can make a projection of what that nicotine value ( will be because it's an expected value based on the measurements that we make. 9 MR M o P H A R T TM W h ^ f WPI Q f h ^ t n n p ? x c* rurx L\LI_ IT n/""vr\ij x JAI n i i a L w o o L U Q L u n c fe-",
Okay. Isn't it true that R.J. Reynolds Tobacco Company investigated whether or not the use of ammonia to increase the -- to affect the pH of cigarettes resulted in increased sales of cigarettes?,I'm sorry? If the pH?,
