question,answer,Declarative_Text
All right. But you do have considerable knowledge regarding the marketing practices of R.J. Reynolds Tobacco Company over the course of several decades,,
based on the work that you've done at R Reynolds?,"Not really. I'm not I'm not in the marketing department. I'm aware of marketing. Obviously, we work with them but I wouldn't say I ha1 consio.eraoie Knowieoge or marKetiing, no. Jage 6 \ .J. | ve",
Okay. You've -- have you reviewed documents that -- internal company business records that pertain j to marketing?,"From time to time I have, yes.",
"And have you reviewed in deposition, ha1 you testified about the things that the R.J. Reynold Tobacco Company has done in the public as it relates their marketing efforts?","I don't know that I have, I've been shown lot of documents in relation to litigation, some marjceLing documents ior certain, OUL I am non. a marketing expert and I wouldn't profess to be that. ve | s \ a ; United Reporting, Inc. Source: https://www.industrydocuments.ucsf.edu/docs/rspw0221",
You're here in your capacity for the R.J. Reynolds Tobacco Company which includes the Brown & Williamson Tobacco Company and the American Tobacco Company?,"l t does, yes. questions that we have today, you will be answering in your capacity as a corporate representative for the R.J. Reynolds Tobacco Company but also speaking on behalf of those companies as well as they are now a part of R.J.",
"Okay. But when I refer to R.J. Reynolds Tobacco Company or R.J. Reynolds or RJR, you know that it's understood that I will be speaking about those three entities unless you tell me specifically otherwise?","I will try to keep that in mind, yes.",
Okay What is your position at R.J. Reynolds?,I am the vice president of cigarette product development.,
"How long have you been in that position? jMMMMMWMMMMMMWWWW^^ -si o United Reporting. Inc. O o Source: https://www.industrydocuments.ucsf.edu/docs/rspw0221 Q A I don f t regard around Q A Q A Q A k Page 8 i How long has that position been in existence? I don't know, probably decades I would think. now -- you know, I'm not a historian with corporate structure, but I would say it's been j for a number of decades. graduated Q old when A Q A Q school? A Q A Q Brown & w And when were you originally hired? I was hired at Brown & Williamson in 1999. What year were you born? 1964. What year did you attend college? \ I started college in 1984 -- '84, ""85. I in '89. \ So you would have been approximately 20 years \ you started college? i About 21, yeah. What year did you graduate? In '89. I'm sorry, what year did you graduate high \ Oh, 1982. j And would you have been approximately 18? Yes. I turned 18 that summer. Okay. How old were you when you started with \ illiamson?","Well, '99, so I think I was 35ish. United Reporting, Inc. Source: https://www.industrydocuments.ucsf.edu/docs/rspw0221 c",
So when you started with R.J. Reynolds in 2004 \ you would have been approximately 40 years old? \,"Uh-huh, yes.",
And what was your position when you were originally hired at Brown & Williamson?,"I was a scientist, so I was hired in as a -- I \ can't remember if it was a scientist three or four, whatever their designation was. I may even have been an \ associate scientist for that first six months.",
"And Brown & Williamson Tobacco Company was a company that produced cigarettes, correct?","They did, yes.",
"And the American Tobacco Company was also a \ company that produced cigarettes, correct?","They were, yes. j",
"And Brown & Williamson and American Tobacco | r o m n a n u a n H T3 ,T R o u n n l H Q h a v o K p p n H P Q i rrn ""inn v_rVJUipdiiy ctxiLi JA . u lAtJy xiu J-u. o HCLVC; uccii u c o i y ii j-iiy , manufacturing and selling cigarettes since before the 1940s, correct?","That would be correct, yes.",
And when did R.J. Reynolds take over Brown & [ Williamson Tobacco corporation?,"R.J. Reynolds and Brown & Williamson actually merged in 2004. United Reporting, Inc. Source: https://www.industrydocuments.ucsf.edu/docs/rspw0221",
Okay. When did the Brown & Williamson Tobacco f Company and the R.J. Reynolds Tobacco Company merge?,In 2004. \ 4 Q And did R.J. Reynolds take over the operations of the Brown & Williamson Tobacco Company?,
And did R.J. Reynolds continue to manufacture f and sell the cigarette brands that the Brown & f Williamson Corporation was selling at the time of the f merger?,"They did, yes. There was a transition period | *7 a a T h h i n V T t"" a 1 If D H a V ^ o i i t * trh D T D f h O Q D h r * a n H cs U O K A t~ V""I e* n ; I d.5> -L Lll-LIllS. J. L d-L IS. t; U aJJUUL WIlCI CJ U l U O C JJ-LClIK-lD WCJ.C Ul t J I I ;: manufactured at Tobaccoville in North Carolina. f",
"And then the American Tobacco Company, also a f company that manufactured cigarettes, correct?","They were, yes.",
And when did the American Tobacco Company f merge with R.J. Reynolds?,"Well, they didn't. Brown & Williamson J en actually acquired American Tobacco in 1994, so that had f I ** I en o United Reporting, Inc. Q Source: https://www.industrydocuments.ucsf.edu/docs/rspw0221 o o happened Q Tobacco 2004? A had made that buy< Q Reynolds A Q A Q A Q A Scientif Q A is the p Q previous to the Reynolds merger. And Brown & Williamson brought American into R.J. Reynolds at the time it merged in In essence, the brands that American Tobacco that Brown & Williamson acquired in that -~ Dut, yes. And is that how you came to work at R.J. , because of the merger? I did, yes. What division of R.J. Reynolds do you work I work in Research & Development. Who is the head of Research & Development? My boss, Danny Herko. And who does he report to? He reports to Jeff Gentry who is the Chief ic Officer. And who does Jeff Gentry report to? I believe he reports to Andrew Gilchrist w resident of R.J. Reynolds. Have you reviewed any of Jeff Gentry's depositions that he has given in tobacco litigation? A you -- I been. I may have some time ago. But I couldn't couldn't tell you what one that would have in l I J in? [ I ho | tell | \ en co o United Reporting, Inc. Source: https://www.industrydocuments.ucsf.edu/docs/rspw0221 Q A Q Reynolds A Q R.J. Rey You know that he has testified in litigation? Sure, yes. And he has testified on behalf of the R.J. Tobacco Company? \ Yes. And he's testified as to time periods when the l nolds Tobacco Company publicly admitted for the first time that it was their position that cigarette smoking diseases A Q A did actually cause lung cancer and other ?",
In Research & Development.,"No, not that I'm not that I'm aware of.",
Are you aware of any medical doctors being 4 employed by Brown & Williamson in any department in when you were hired?,"There was an on-site doctor in Louisville, but, I mean, he was a medical doctor treating the employees,",
"Like they had a clinic, if somebody got sick they could go to that --","Yeah, they did. But in terms of R&D, no, not that I'm aware of.",
Nothing that physician that you just referred to did nothing other than run a clinic essentially inside of Brown & Williamson for employees who might need medical services? JL ' Jr\. JL i L O. L- O ILl y LJ i I w*. t ? L O L CL11 \JL Am 11 ^-A y >3- wt -L O \l AITS yOU clWcLITG 0 1 3. p l i y S X CXciri / 3i mSQXCcLX QOCL.02T working in the Research & Development department ever at R.J. Reynolds?,"I believe that Dr. Eman was the head of the department in the early '90s who was -- who was an MD. And there may have been others. But in my tenure there, no, there has not been.",
"Okay. You know that doctor -- this Dr. Eman !-!MHM'W^!WWMW!WWiTOWMWMhWffiBWH^ United Reporting, Inc. Source: https://www.industrydocuments.ucsf.edu/docs/rspw0221 was a medical doctor? |","I believe he was, yes.",
"You say ""I believe he was,"" I mean, are -- f","I mean, I have not met the man, so I didn't -- | I didn't look for his credentials, but I'm giving you the best information that I have.",
How do you know that he was a medical doctor? ;,"I believe -- I believe he was an MD, so I think that was part of his qualifications, but I haven't j met the man.",
How is it that you know he was an MD is my [ question.,"Oh, talking to other people who worked there at the time. i",
Do you know what his medical training was I related to? f,I don't off the top of my head.,
But it's your understanding that he was head | of the Research & Development department in the early f 90s? j,"I think so, around '94/'95 timeframe, sort of f mid '90ish.",
Have you seen any documents authored by him? |,"Not that I recall, no.",
Have you seen any documents authored by him \ CO (Joked Reporting. Inc. Source: https://www.industrydocuments.ucsf.edu/docs/rspw0221 o o where he took a position on whether or not during the \ time that he was employed at R.J. Reynolds Tobacco Company he believed that cigarette smoking was the cause | of any disease including lung cancer? |,"Have I seen documents? No, I have not.",
You've seen documents where individuals within \ Research & Development offer them and circulate them to some degree within the company? \,"Yes, I've seen lots of documents, yes.",
"And you've seen documents by the head of j Research &. Development where those documents have also [ been circulated internally in the company, correct?","I have seen some, yes, sir. {",
So it wouldn't -- j,Certainly. \,
It wouldn't be unusual for you to see a document by the head of the Research & Development f department?,"I don't know about how common it is, but I have seen them, yeah. |",
"Okay. And how many documents do you think \ that you have we'll get in -- strike that -- we'll get into the work that you've done as an employee of Brown & Williamson and R.J. Reynolds, but also the work that you've done in connection with your testifying in J United Reporting, Inc. 7*J*T'""IW/A-D"" ,""AI.XA. I Source: https://www.industrydocuments.ucsf.edu/docs/rspw0221 litigation, but combining the two to- -- two capacities \ together, how many documents, internal business records, do you think you have reviewed?","Internal business records, it's hard to put a number on it. My reliance list is over a thousand f documents long, those are not all internal records obviously. But it's probably safe to say I've seen probably thousands, I guess, of documents over -- over f time, internal documents. jj",
"And in the thousands of documents that you've f seen over time, you've never seen a document authored by I Dr. Eman? \","No. And I haven't -- honestly, I haven't looked for one either, so I suppose I could I suppose j I could search, but I have not.",
And have you seen any documents where he was \ designated as the recipient or somebody who was CCed on | a document?,"I believe I have, but, you know, I'd have to | go and look and check that. \",
"Nothing comes to mind specifically, though? \","No, not that no. And his name doesn't often come up in these type of proceedings. So, no, not \ that I can think of off the top of my head, but it's certainly possible. United Reporting. Inc. Source: https://www.industrydocuments.ucsf.edu/docs/rspw0221",
So in connection with your employment at R.J. Reynolds Tobacco Company you also serve as a witness for \ litigation? j,"I do, yes.",
And you do that as part of your employment?,It's not a part of my job description but I agreed to do that around 2008.,
Okay. And you do that on behalf of the R.J. Reynolds Tobacco Company?,Yes.,
You don't do that in your own personal capacity?,I do not.,
How many people work in the Research & | Development department presently?,About 188 currently.,
And has that number increased or decreased since you started in 2004?,"It's kind of gone up and down. So in there were, I think, close to 300 R&D employees. And it \ has gone down and it's come back up. Certain divisions have moved away from R&D so -- and are no longer JL U k-J w JL L-. JL 11 -J L* \J X\ Oc LJ O \J L. I i vl? 11 >H- d \A, w \J LlilL* IIUII LLJkJ tzi. X. 11 Ct o """" """""""""" IL Ct *y moved around quite a bit.",
"And in 1999 when you started with Brown & United Reporting, Inc. Source: https://www.industrydocuments.ucsf.edu/docs/rspw0221 o Page 18 I Williamson, how many individuals were working in the R&D \ department there? A Q A Brown & W Q the time; A name. I Susan Ivy president Q merger in r\. new Reyno Q A Somewhere around 120. I And who was head of R&D when you were there? Tilford Reel was the head of R&D when I joined f illiamson. f Who was the president or CEO of the company at | do you know? | ji It -- I'm trying to remember the person's \ can't remember off the top of my head, but j very shortly after I joined the company became | and CEO of Brown & Williamson. \ Did she remain the president and CEO until the [ 2004? | She did, yes. And then she became CEO of the Ids company. Who's the CEO presently? j Currently of RAI, which is the parent company, [ is Dan Delen. Q A Q subsidiar A Q RAI is Reynolds American? j J_ L -L O . And the R.J. Reynolds Tobacco Company is a y of RAI? | Correct. [ Are there any other subsidiaries of RAI? | en CA3 United Reporting, Inc. Source: https://www.industrydocuments.ucsf.edu/docs/rspw0221",,
"What? j A inere is oanue re Natural looacco company; there is ASC, which is American Snuff Company; there is Niconovum, which is a pharmaceutical company; there is R.J. Reynolds Vapor Company; and I believe there is an if it's Reynolds International or some other name. But I think I've covered the basics, though.",,
What is RJR Vapor?,It's a subsidiary company that makes,
And what is the brand name of those JL TE JJ VMH -J- VJ C I J v-jr L* L* *w- O 1 *,"Vuse, V - u - s - e .",
Can you spell that again?,"V-u-s-e, Vuse.",
Do Vuse have nicotine in them? JL wf *\ J. \ O,,
Do Vuse have any tobacco in them?,No.,
How does the nicotine who controls the tL* -+j C A 1L I V J KM 1 i. L> VW/ JL 1 1 JL VM? \y \** JL 1 1 \Zr \** 1 JL CA L* VMJ V / tl> O JL X 1 L> \ J L> 1 1 V* V LJl O vZ* *,"R.J. Reynolds R&D through, what do you call I en w it, agreements that the companies forged. IMWWiWHWBBiHWBWHHBSWgBM^ United Reporting, Inc. cn Source: https://www.industrydocuments.ucsf.edu/docs/rspw0221",
What does that mean?,I'm sorry. Service level agreements. It1 i s a basic service level agreement between the vapor company j and R.J. Reynolds.,
"Okay. But what does that mean, through service agreements? You control it through service agreements, what does that mean? i","Oh, I'm sorry. Not the -- I'm sorry. The I business interaction as through service level DrrrpPlTIPnt' Q TVip \*A. \m4 4w \m \w- ILL Vw l i L *mf * X 1 1 Vw How we make the liquid? It's made in a manufacturing-type setting, so you control how much j j the ingredients that you would add just like you would j control anything else that one would try to make in terms of putting additives together.",
Are there additives in Vuse cigarettes?,"There are. It's mostly glycerin, water, pharmaceutical grade nicotine and flavor packages.",
"What do you mean by flavor packages, what that?",Proprietary flavors to give the aerosol a la* G> *J L- \H* *,
"You do that to make it taste good to the consumer? I I i is | 'I United Reporting, Inc. W Source: https://www.industrydocuments.ucsf.edu/docs/rspw0221",,
What would the taste be without those flavor \ pacKayes.,"It would be fairly bland, maybe a little \ bitter. So it's a typical flavor to make it taste \ taste good to a consumer.",
And the flavor packaging is done for purposes | of selling the product? j,"Well, it's done to be so that the product is acceptable to a smoker. So, yeah, I guess, in essence, it would be, sure.",
And you could sell it without the flavor packages?,"I don't know that we would sell it. I don't know that anybody would buy it, but I suppose you could, |",
So the primary purpose of the flavor packages is to put it into a form that a consumer will buy?,"Correct. Just like nicotine-containing gums, | like Nicorette gum comes in a variety of flavors, fruit j JL- JL C* v \*t JL o CX 1 i *wl v** JL 111 I Cl 1LI v*/ 11 JL JL Cl V v** X, O * X 11 v3- V vJ. vJ L i 1 OL Lf O \*J L. 11 CX lw j_s y0U know, so that the consumer who buys it enjoys f it, so, yeah, it's the same basic premise.",
"You're talking about, like, Nicorette? j","Sure, yeah. |",
Nicotine replacement therapy?,"Correct. Uoited Reporting, Inc. Source: https://www.industrydocuments.ucsf.edu/docs/rspw0221",
A nicotine replacement therapy that is primarily used by individuals who would like to stop smoking? T; /\ Lorr6ct^ yes.,,
"You've seen the notice, though, correct?","I have, yes. Do you need me to look it over?",
"No, I just want -- you've actually had a chance to look at it before? United Reporting, Inc. ui Source: https://www.industrydocuments.ucsf.edu/docs/rspw0221 Page 23 t","I did last week sometime, yes.",
You looked at one of the versions of it? j,"I think. I proDaJoly looked at that version, it ; I'm not mistaken.",
Okay. And you've seen the categories and the areas that are depicted in the notice?,"I have, yes.",
And you said that you have been involved in | litigation on behalf of R.J. Reynolds since 2008?,That is correct.,
"And I know that you have testified regarding j the number of depositions you've given and the number of j trials that you have participated in, what's the -- \ what's the current number of depositions you think [ you've given? \","Depositions, I don't you know, I don't j count them. The lawyers will keep track of that. If you look on my disclosure I think they're all listed, j you can count them up, but I think it's around 45 or 46, it could be more or less than that.",
How many depositions have you given this year?,"I don't know. Probably, I would think, maybe half a dozen.",
"How many times have you testified at trial this vGcLr United Reporting, Inc. 0> Source: https://www.industrydocuments.ucsf.edu/docs/rspw0221",Twice.,
How many times have you gotten ready to testify in trial this year?,More than that.,
And then approximately how many trials have you participated in since 2008?,"I think my first trial was in 2009, I think I've been in I think I've testified 20 20 times.",
"And in getting yourself prepared for either depositions or trials, you have met with attorneys for R.J. Reynolds Tobacco Company?","I have, yes. Certainly in the past I have, but we certainly meet, yeah.",
"And do you remember testifying in the Hughes case, California?",I have not testified in that case.,
By deposition.,"A deposition is not completed yet, but I did begin a deposition in the Hughes and Majors case.",
Okay. Do you recall testifying in the Hughes case that you have you would approximate the hours that you have spent meeting with lawyers over the years in preparation for other depositions for trial in the hundreds of hours? w,"Yeah, I can't remember if that's what I said | J United Reporting, Inc. Source: https://www.industrydocuments.ucsf.edu/docs/rspw0221 or not, but it sounds reasonable. That's -- over the years i would say that's probably reasonable, yeah.",
Okay. Because you don't specifically track the number of hours that you sit down and meet with a,"I do not, no.",
"So when you gave an estimate, it would be reasonable that you have spent hundreds of hours, that was your best estimate of the time that you spent working with attorneys getting ready for either deposition or trial in the work that you do for R.J. Reynolds?","I represent R.J. Reynolds, so, yeah, we certainly take litigation seriously, so I do prepare. The bulk of the time I spent with lawyers would have been in 2008 where I met with them on a weekly basis to really learn the history of Reynolds. So from a case-specific perspective we don't spend very much time getting ready for depositions or trial anymore with Z\) the ~*~~ with some exceptions .",
"My question was, in testifying that it would be reasonable to estimate that you have spent into the hundreds of hours in preparation for either deposition or t~rial is based on vonr best* e tiTna't"" of"" hVipi +-1 m c oi ' *:; w -si that you have spent doing that since 2008, that was my Ol o United Reporting, Inc. Source: https://www.industrydocuments.ucsf.edu/docs/rspw0221 H. question A Q actually A Q In total, yes, I would say so. And then there's also time spent obviously in usposiLion as well as in trial, correct. i There is, yes. Okay. And, typically, how long do your depositions last on average? \ /\ You know, it depends on -- you know, it's not j my deposition so it's really on the plaintiff's attorney | to make so it's Q A the determination how long they want to spend, hard to say. Okay. | Some of them last, you know, more than a full eight-hour day, some of them last 45 minutes, so it's j it's qui Q estimate you have c\ Q hundreds 2008? A never th te variable. j My question was, though, do you have an j as to what the average number of hours is that testified in deposition? | Oh, I don't have that estimate, no. j You would expect -- strike that. Would a reasonable estimate be into the I of hours, if you had given 45 depositions since j I mean, I would think so, I just really have ought about it, but, you know, I would say so. \ Ol CO o United Reporting, Inc. Source: https://www.industrydocuments.ucsf.edu/docs/rspw0221 I mean, they certainly last an hour and I've done about of them, so it's probably not unreasonable to think that there's hundreds of hours there. But I never j really bothered to count it up or think about that.",,
"Okay. And in the testimony that you have given actually at trial in the 20-plus trials that you estimate that you've given, you probably will be into at \ least over a hundred hours of trial testimony, correct, if you've done that 20 times?","Again, I don't know. I never really thought about it. It could be it could be a hundred hours, it could be over a hundred hours, it could be a little j less. I haven't really thought about it. I mean, sometimes I only go on the stand for, you know, like a two- or three-hour period, so it's hard to say. j",
"So either between - either testifying in deposition or trial or preparing with attorneys to testify in deposition or trial, you have devoted many \ hundreds of hours for that type of work that you do on behalf of R.J. Reynolds Tobacco Company, correct?","Again, I don't characterize it as work, it's something I chose to do. It's not part of my job description, but in that sense, yes, I'm an experienced j witness, I've spent many hours doing this, so, yes.",
"And how many attorneys do you think that you | United Reporting, Inc. Source: https://www.industrydocuments.ucsf.edu/docs/rspw0221 have met prepared A but I do are tryin you know, that I've with in these hundreds of hours in getting j for either deposition or trial? Mainly the folks at Womble -- Womble Carlyle, | meet with the individual trial attorneys who g the case to go over my direct testimony. So, \ again, I don't know ~~ there have been trials been to that, you know, I've had the same representation, so somewhere less than 20 trial attorneys H I ~ P - J - * , - - j ^ r t . i ^ j - . ^ . ' i . j . Q * * _ y . g - ^ - p , - v 1 I J - Q a 4 * T V T y "" \ Y Y \ f \ j j C i { "" * S "" K * 1 \ / 1 o > ' that I met with in preparation. Q /TL Q an office A Q American? A Q A Gray Tech Winston-S Q A Womble Carlyle is a law firm? They are, yes. And their law firm is located in they have in Winston-Salem? \ They do, yes. \ And is that office next door to Reynolds j It is, yes. How f3,r is that office fTQrn vour ofriCG^ * It's several miles away. I work at the Bowman | nical Facility which is in another part of alem. \ i But y'all work in the same city? j Correct, yes.",,
"And have you had meetings with attorneys in ( United Reporting, Inc. Source: https://www.industrydocuments.ucsf.edu/docs/rspw0221 Page 29 I the Womble Carlyle office? |","Uh~huh, yes. \",
Approximately how many attorneys at Womble Carlyle do you think you've worked with getting ready f for deposition or trial? f,"Like maybe five or six. Mostly just two or | three, but over the years probably about five or six.",
Who were the -- who were the five or six? \,"Mr. Latham, Will Latham; Chris Kreiner; Janna j Newsome, who's no longer with the firm. I worked with j Phillip Brown, who's an attorney there. Whitney Passmore, another attorney there. Geoffrey Beach, I've \ worked with. Those are the folks I can think of off the top | of my head. I mean, mostly it's been Will Latham and \ Chris Kreiner. \",
Who have you met with in regards to this case? \,Will Latham.,
Just Mr. Latham?,Uh-huh.,
Yes? \,"Yes. Sorry, didn't mean to mumble.",
"That's okay. Shook, Hardy & Bacon, you're j familiar with that firm? j","I know of them. | ro United Reporting, Inc. Source: https://www.industrydocuments.ucsf.edu/docs/rspw0221 Q tobacco A Q Hardy & Page 30 I They represent a cigarette manufacturer in \ litigation? \ Phillip Morris, if I'm not mistaken, yes. \ Have you worked with any lawyers at Shook, Bacon in connection with either preparing for deposition or trial? A Q A Q A Q you thir A No. No. No, I have not. Jones Day, are you familiar with that firm? Uh-huh. Yes? Yes. T+- ' c okav How rnanv 1 wvpr*? at Jonps Dav do ik you've worked with? I'd have to think about that. Certainly Jones \ Day represents R.J. Reynolds. They often -- they often try cases. I don't know, maybe I haven't thought | about tr ying to figure out how to name those guys, but I l could name a few. j Q A Bierstek Q A n r e. Q Sure, go ahead. Stephanie Parker, I've worked with. Peter .er, Steve Kaczynski, Belasic, I've worked with. | Mark Belasic? Yes. That's all I can think of as I'm sitting \ John Yarber? \ United Reporting. Inc. Source: https://www.industrydocuments.ucsf.edu/docs/rspw0221 A Page 31 j",
