question,answer,Declarative_Text
"R.J. Reynolds recognizes that cigarettes i!4 manufactured Dy R.J. Reynolds had, in fact, caused lung cancer and other fatal diseases in smokers who have used ' IWWWMWWWWWIWW^^ O l GO o United Reporting, Inc. Source: https://www.industrydocuments.ucsf.edu/docs/rspw0221 those cigarette products, correct?","We would, yes.",
"R.J. Reynolds recognizes that the cigarettes that they had designed, manufactured and sold in the 1960s, '70s, '80s, '90s and into the 2000s is inhalable by the smoker?","We certainly would recognize that smoking cigarettes, that people will inhale, we know that. Anything is inhalable, however. Inhalation is a learned behavior.",
What did R.J. Reynolds do to alter the design of the cigarettes that they manufactured and sold in the 1960s such that the smoker would not be able to inhale cigarette smoke into their lungs?,,
Yes.,Nothing that I am aware of. Inhalation is rarely talked about in the documents.,
What did the R.J. Reynolds Tobacco Company do to alter the design of the cigarettes that they manufactured and sold in the 1970s to address cigarette smokers inhaling cigarette smoke from their products?,"Nothing that I'm aware of. United Reporting, Inc. Q*54S""'5-^2''1 en GO o Source: https://www.industrydocuments.ucsf.edu/docs/rspw0221",
What did R.J. Reynolds Tobacco Company do to alter the design of the cigarettes that they manufactured and sold in the 1980s to address the fact that cigarette smokers were inhaling cigarette smoke from their cigarette products?,Nothing that I'm aware of.,
What did R.J. Reynolds Tobacco Company do to alter the design of the cigarettes they manufactured and sold in the 1990s to address the fact that cigarette smokers were inhaling the cigarette products that they manufactured and sold?,To my knowledge nothing that I'm -- that I'm aware of.,
"What did R.J. Reynolds Tobacco Company do to alter the design of the cigarettes they manufactured and sold in the 2000s to address the the feature of the cigarette that allowed smokers to inhale cigarette smoke into their lungs from their cigarette products? MR, LATHAM: Objection to form.","There is no feature to allow people to inhale, it is a learned behavior. To my understanding, Reynolds has not addressed whether or not cigarette smoke can or shouldn't be inhaled.",
"Okay. Same questions for Doral Menthol Lights, what did R.J. Reynolds Tobacco Company do with 'TOWWiBWgBSiSSSB^ United Reporting, Inc. Source: https://www.industrydocuments.ucsf.edu/docs/rspw0221 respect to altering the design of Doral Menthol Lights such -- such to address the fact that smokers inhale cigarette smoke from that product?","They did not do anything with regard to inhalation as far as I know, that was never an issue.",
"What did the R.J. Reynolds Tobacco Company do with respect to Salem Lights, Salem, Kool, Kool Lights, Winston and Winston Lights with respect to altering the design of those cigarette products to address the fact that cigarette smokers inhale the smoke from those cigarette products? JL KL* DL . 1 1 1 v3- v i. w iO -J v-J 1X \ J J L* 1 i. \*J KJ \Z* V^ L. S-J Q . X. vl^ L- L- v** O W CI. iZJ X1 \# V C> JL altered to try to account for anything to do with inhalation.",,
What did R.J. Reynolds Tobacco Company do to alter the design of the cigarettes they manufactured and | sold in the 1960s to make it difficult for the smoker to i inhale the smoke into their lungs?,"To my understanding that was never done and I don't know that -- that that is a -- that you can even do that. Because I know for a fact that some of the harshest smoke that I know of is cigar smoke, that people inhale cigar smoke. So inhalation is a learned * jfc JkmJ Km* X J. CJ. V JL \** JL * JL Lr 1 1 CX O JL -L- K* L- JL vl v* v / v l vJ W JL L* 1L KJ JL \J vJ. \JL \** L* vj- C* O JL y 1 1 *",
"Okay. What did the R.J. Reynolds Tobacco 'UWI-!!M!!-MWM!'!-H^ Oi GO I cn o United Reporting, Inc. Source: https://www.industrydocuments.ucsf.edu/docs/rspw0221 Company do to alter the design of the cigarettes they | manufactured and sold in the 1970s, '80s, '90s and 2000s f to make it difficult for the smoker to inhale the smoke into their lungs?",Nothing that I'm aware of.,
Okay.,Not for those particular reasons.,
What did R.J. Reynolds Tobacco Company do to alter the design of the cigarettes they manufactured and | sold in the 1960s to prevent smokers from becoming addicted to their cigarette products;,"It was never addressed in the 1960s, mainly because cigarette smoking was not considered to be j addictive at that time.",
So I'm going to ask you the question again. | What did R.J. Reynolds Tobacco Company do to alter the design of the cigarettes that they manufactured and sold \ in the 1960s to prevent users of the product from j becoming addicted to the product?,Nothing. And cigarette smoking was not considered addictive in the 1960s.,
"Move to strike the last part of your answer as \ nonresponsive. What did R.J. Reynolds Tobacco Company do to I United Reporting, Inc. Source: https://www.industrydocuments.ucsf.edu/docs/rspw0221 alter the design of the cigarettes they manufactured and sold in the 1970s to address the user of the product from becoming addicted to cigarettes?",Nothing. And cigarette smoking was not considered to be addictive in the 1970s.,
What did R.J. Reynolds Tobacco Company do to alter the design of cigarettes they manufactured and sold in the 1980s to address the -- whether the smoker would become addicted to using the product?,"Again, in the 1980s there was nothing -- that issue was not addressed. There were no alterations that I know of that were made to the product. It was not",
What did R.J. Reynolds Tobacco Company do to alter the design of the cigarettes they manufactured and sold in the 1990s to prevent users of the product from becoming addicted?,"Nothing that I'm aware of. It's not been addressed, per se. No.",
"What did R.J. Reynolds Tobacco Company do to United Reporting, Inc. Source: https://www.industrydocuments.ucsf.edu/docs/rspw0221 users of the product from becoming addicted?",Nothing that I'm aware of. It's unknown how that can be done.,
What did R.J. Reynolds Tobacco Company do to alter the design of Doral Menthol Lights to prevent users of the product from becoming addictive?,"Again, that issue has not been -- there's no alterations to address that particular issue. alter the design of Winston, Winston Lights, Salem, the users of those products from becoming addicted?",
"When R.J. Reynolds designed, manufactured and sold Winston, Winston Lights, Salem, Salem Lights, Kool, those cigarettes would expose the smoker to carcinogens in sufficient quantities to cause lung cancer in the ^WWWi^W^WI^^WWWS^^ CO Ol o oo United Reporting, Inc. Source: https://www.industrydocuments.ucsf.edu/docs/rspw0221 o smoker, r\ Q Page 90 I rirs-yyctrrf''*? \",,
"Any diseases that have been linked to being caused by smoking, did R.J. Reynolds intend their cigarette products to cause those diseases?",R.J. Reynolds never intended to cause any disease through the use of their products. So my answer would be certainly not -- no product was designed to do that.,
"When R.J. Reynolds designed, manufactured and sold Winston, Winston Lights, Salem, Salem Lights, Kool, Kool Lights and Doral Menthol Lights, did R.J. Reynolds intend for the smoker to become addicted to the nicotine?","No, they did not.",
"With respect to those brands that I just listed that R.J. Reynolds designed, manufactured and sold, did R.J. Reynolds intend that the cigarettes would deliver nicotine in sufficient quantities to sustain addiction?","No, they did not.",
"Okay. R.J. Reynolds recognizes that, for example, Doral Menthol Lights delivers nicotine in sufficient quantities to sustain addiction, correct?","I would I would say the answer to that is United Reporting, Inc. Source: https://www.industrydocuments.ucsf.edu/docs/rspw0221 yes and no. Because no one knows what that line is, what -- what amount of nicotine can be delivered that would not sustain somebody who's addicted to nicotine. I don't think that that has been scientifically established. So we it's a yes and no answer. I'm sorry to not being any more specific than that.",
"But you know R.J. Reynolds knows that the level of nicotine that's contained in a Doral Menthol *J J_i JL \A XXL. -X. O O KX -L J_ _L W J- *w ILL- ' L* \~J O LA 13 L# O. L 1 I OL L A \JL JL v.** L- JL U XX L# w i I JL w w L* JL X 1 CT / correct? MR, LATHAM: Objection to form.","The amount that's in current all current cigarettes today are considered to be addictive, so I guess the answer would have to be yes, that is known.",
"When R.J. Reynolds designed, manufactured and lo sold Winston JLigntis, oaiern. LiignLS, JAOOI LIgrits, uorai Menthol Lights, R.J. Reynolds intended for the smokers of those cigarette products to block the vent holes?","No, certainly not that.",
"When R.J. Reynolds designed, manufactured and sold Winston Lights, Salem Lights, Kool Lights, Doral Menthol Lights, it. was R.J. Reynolds intent that smokers would block those vent holes altering the way the cigarette was smoked by the user, correct? TT?vS???!SgT!?CTffi^^ en GO United Reporting, Inc. Source: https://www.industrydocuments.ucsf.edu/docs/rspw0221","No. That was never intended, no.",
"Okay. When R.J. Reynolds designed, manufactured and sold Winston Lights, Salem Lights, Kool Lights and Doral Menthol Lights, RJR intended for smokers to smoke more deeply and take more puffs of those cigarettes, correct?",No.,
"When R.J. Reynolds designed, manufactured and sold Winston, Winston Lights, Salem, Salem Lights, Kool, Kool Lights, Doral Menthol Lights, R.J. Reynolds expected that those cigarettes would expose smokers to cause lung cancer and other fatal diseases?","No, that's not necessarily true, no.",
Is it indirectly true?,"Certainly Reynolds knew by the time those products were designed, because I believe those would be in the 1970s, that carcinogens would be present in cigarette products, but it would not be intended that",
"Right. My question is: So when R.J. Reynolds u */ \Ji v3T O JL vJ i i KZr \JL t 11L d 11 vJl JL CL w L* Ul JL KZ \*X OL 11 v** O v- JL \*A L* 1 1 v-/ O *3T hJ JL \J VJL Li. \~* L* I O / f V J L l l C S L - KJ l i t Winston Lights, Salem, Salem Lights, Kool, Kool Lights 1 en CO and Doral Menthol Lights, did R.J. Reynolds expect that en o United Reporting, Inc. Source: https://www.industrydocuments.ucsf.edu/docs/rspw0221 those cigarettes would expose the smoker to carcinogens in sufficient quantities such that it could cause lung cancer and other fatal diseases?",And my answer would be no.,
"Okay. And that would be true for the cigarette -- those same cigarettes that we just listed from the 1960s through the 2000s, that R.J. Reynolds did not expect that those cigarettes strike that. Same question I just asked you. When R.J. Reynolds designed, manufactured and sold Winston, Winston Lights, Salem, Salem Lights, Kool and Kool Lights and Doral Menthol Lights, R.J. Reynolds -- did R.J. Reynolds expect that the smoker would become addicted to nicotine?","No. Again, they would not have expected that, depending on the time frame, but certainly not.",
"Okay. When R.J. Reynolds designed, manufactured and sold Winston, Winston Lights, Salem, Salem Lights, Kool, Kool Lights and Doral Menthol Lights in the 1960s -- well, let me ask you that -- when did Doral Menthol Lights first come on the market?",Doral Menthol Lights? I think in the '70s.,
Okay. Kool Lights?,"Kool Lights would have been early '70s or mid . ^ ^ f f l ^ l j l ^ ^ ^ cn o United Reporting, Inc. Source: https://www.industrydocuments.ucsf.edu/docs/rspw0221",
"Salem Lights? JTA, ""*y - /' ILLx m ' u o",,
Winston Lights?,"Winston Lights was, I think, in the '70s as well. They were all in the '70s. All the Lights products were in the '70s.",
"Okay. When R.J. Reynolds designed, manufactured and sold Winston Lights, Salem Lights, Kool Lights and Doral Menthol Lights in the 1970s, did R.J. Reynolds expect that the user of those cigarette products could become addicted to it?","They would not have expected that, no. And mainly because they were not -- cigarettes were not considered to be addictive in the 1970s. of your answer as nonresponsive.",
"When R.J. Reynolds designed, manufactured and sold those same cigarette products that we just listed from the 1970s, when they were sold in the 1980s, did R.J. Reynolds expect that the users of those cigarette products would become addicted?","They would not have, no.",
"Same question for those same cigarette products in the 1990s, did R.J. Reynolds expect that the | JJ users users of those cigarette products would become CO "">l CO United Reporting, Inc. Source: https://www.industrydocuments.ucsf.edu/docs/rspw0221 addicted? |","They would not have, no. |",
"Okay. When R.J. Reynolds designed, manufactured and sold Winston, Salem, Kool, Doral ] Menthol -- well, strike that -- just Doral Menthol, when j did Doral Menthol come on the market?",I think it was in '70s.,
"""70s. Did it come on the market in a regular brand as a menthol before the '70s; do you know?","Menthol? I'd have to go back and check. It's j obviously verifiable. It may have came out in the | early -- excuse me, very late 1960s. I just don't know if the menthol was in or not, but --",
"But if I include it in the brands -- a list of | brands, Doral Menthol in the 1960s, you wouldn't | reasonably dispute that for the purpose of my question? j",Doral Menthol? I just don't know specifically. I won't I won't dispute it for your [ general question.,
"Okay. I was just trying to make it easier. j When R.J. Reynolds designed, manufactured and sold Winston, Salem, Kool and Doral Menthol in the 1960s, was \ i f T? .T R o u n n 1 H Q ' o y n o p l "" 3 1 i n n ^Vt^t"" f- h o i - Q / -v Q r\^r ""h ""h f""s Q O JL L* X\ U i X\ t^yllVw/XLlO C A U C L U u L X v I l U11CIL- L-11 \l U. > t? JL O \J JL L-11 >*/ > t? cigarette products would become addicted? \ United Reporting, Inc. Source: https://www.industrydocuments.ucsf.edu/docs/rspw0221","It would not have been their expectation, no.",
"Same question for the 1970s, '80s and '90s as JLL> -L v* J_ CL U C7 D U\J LrllC? L4iw>>c2 wJL Lll U w \ L-1 i w u v O ^ K v,*. J- J- X V** cigarette products, was it R.J. Reynolds' expectation I that the users of those cigarette products would become addicted?",It would not have been and it would not have been the company's position in those time frames that \ cigarette smoking was addictive.,
"Okay. When R.J. Reynolds designed, manufactured and sold Winston, Winston Lights, Salem, j Salem Lights, Kool and Kool Lights and Doral Menthol \ Lights, was it R.J. Reynolds' expectation that smokers \ of those cigarette products would block the vent holes \ of those products which had vent holes?","Of the products that would have had vent holes, they wouldn't have expected it, that was not the design intent, although they recognize that people would -~ that some people probably would, at least from j time to time. \",
That was something they learned after -- j,Uh-huh. i,
Yes?,"That was not -- yes. It was not -- yes, that was something they would have learned after and that was \ en o (O United Reporting, Inc. Source: https://www.industrydocuments.ucsf.edu/docs/rspw0221 not the design intent.",
"Okay. R.J. Reynolds recognizes that smokers of, quote/unquote, light cigarette products will take deeper breaths of the smoke when they puff on the","I can't agree with that, because smoking i behavior is so variable",
You recognize that happens?,"It can happen, yes. Certainly.",
"And it can happen because of -- of the way that the light product is designed, correct?","No, that's not how.",
It has nothing to do with the design of the product?,"No, if I can explain I will. When a person who smokes a cigarette, if they smoke a heavier cigarette and are used to that cigarette -- or are acclimated to that product, if they try a light -- lighter cigarette, they are going to immediately notice a difference, and then likely or possibly take a larger puff to try to get what they were used to from a heavier cigarette. That does happen. That's been recognized for a long period of time. The -- that type of behavior is not necessarily sustained for a long period of time, but it can happen during that transition period. 1-BWMiMJHWWMMBWWWWWWMWHBH^^ o CO United Reporting, Inc. Source: https://www.industrydocuments.ucsf.edu/docs/rspw0221",
"R.J. Reynolds, then, recognizes that when a individual smokes a, quote/unquote, light cigarette, that they can, because of the differences in between a regular cigarette and a light cigarette, take deeper puffs on the cigarette?",I think,
I think what you just testified to.,Yeah. I think Reynolds has always recognized that human smoking behavior is highly variable. It is a human behavior -- smoking itself regulating is a self-regulating behavior. So people are going to change their behavior based on the product that they're presented with. It does not mean that that's what the,
"When R.J. Reynolds designed, manufactured and | sold Winston, Winston Lights, Salem, Salem Lights, Kool, Kool Lights and Doral Menthol Lights in the '60s and '70s, given that the light products didn't come on the market until the '70s, was it reasonable for R.J. Reynolds not to expect that those cigarettes would expose a smoker to carcinogens in sufficient quantities to cause lung cancer years down the road?","Was it reasonable? That was not Reynolds' T f l j B j j j i j y ^ Ol CO ""Nl o (O United Reporting. Inc. Source: https://www.industrydocuments.ucsf.edu/docs/rspw0221 position at that time, that it that it was known that that's what would happen.",
Right. So you're --,"But there was certainly they recognized there was an association between smoking and lung cancer. As -- with regard to your specific question on the exposure to carcinogens, I think the answer has to be no.",
It was not reasonable for R.J. Reynolds to expect that users of those cigarette products would -- would be exposed to carcinogens in sufficient quantities to develop lung cancer years down the road after chronic use? 14 A I think Reynolds I don't think it's kind of a convoluted question.,,
I just want an answer to that question first.,Okay.,
"Let me restate it again, hold on. I just want j to restate it again and then you can explain, but I would actually just -- just for the purposes of the record, I would like an answer to the question first.",,
"You understand -- Reynolds understands that \ cigarettes deliver carcinogens in the cigarette smoke to j the user, correct? fl I C J / U I 1 fc* V \Ji \J m",,
And Reynolds understands that cigarettes deliver carcin0gens to the smoker in sufficient j quantities such that the smoker can develop lung cancer and other fatal diseases after chronic use?,"Some can, yes.",
"Okay. And my question is, when R.J. Reynolds I designed, manufactured and sold Winston, Winston Lights, j Salem, Salem Lights, Kool, Kool Lights, Doral Menthol j Lights in the 1960s and '70s, was it reasonable for R.J. \ Reynolds not to expect that those cigarettes would \ SHJ A k-* \J O K *** 11 C2 Oi.lL \J IV % JL L- \J \** CX -L. L*- JL 11KJ \~\ v3 1JO JL 11 O t*4 J*- ~L L \^ JL w 11 L. quantities such that it could cause lung cancer or other [ fatal diseases? j",,
"Well, I'll reverse it.","I mean, I'm trying to -- \",
"Let me reverse it. I'll give you a better question, then. United Reporting, Inc. Source: https://www.industrydocuments.ucsf.edu/docs/rspw0221 http://Oi.lL","Okay. Please. Thank you. sold Winston, Winston Lights, Salem, Salem Lights, Kool, Kool Lights and Doral Menthol Lights in the 1960s and D /Us, it was reasonable tor- R.u. Reynolds lobacco Company to expect that the users of those cigarette products would be exposed to carcinogens from those cigarettes in sufficient quantities to cause lung cancer? It was reasonable that R.J. Reynolds would expect that, right?",
So it was reasonable -- have to explain because I don't believe that R.J. Reynolds knew whether or not the exposure to carcinogens that were in cigarette smoke would have been -- explained the association between cigarette smoking and /L<J disease. JO 1 L WOUICI not nave oeen reasonaoie tor Reynolds to expect that.,,
So --,"I'm sorry, it's a long very long questions, very complicated questions.",
"Sure. So then there were then the reverse on United Reporting, Inc. Source: https://www.industrydocuments.ucsf.edu/docs/rspw0221 of that or actually the opposite of that would be true, that it was not unreasonable for R.J. Reynolds -- strike that. It was then, and based on your testimony, it was reasonable for R.J. Reynolds not to expect that those cigarette brands that they designed, manufactured and sold in the 1960s and '70s would deliver carcinogens in sufficient quantities to the user such that chronic - / L I O v L* \_J L I JL L4. LA * 3 V t J- w KJ JL LX 11LJ L*- CX11 LK W -L CX i 1 \JL L/ L- 1 i vH- L -L CX, U CL JL LA JL O w CX O C* O",,
"And then the indi- -- the consumers who purchased and used Winston, Winston Lights, Salem, Salem Lights, Kool, Kool Lights, Doral Menthol Lights in the 1960s and '70s, it would have also been reasonable for them not to have expected that using those cigarette products would expose them to carcinogens in sufficient quantities such that chronic use of those products could cause them to develop lung cancer and other fatal diseases, correct?","Are vou askinq me whether or not people would -- sorry, I'm just trying to clarify it in my head.",
Okay.,Are you asking me whether or not it would be reasonable for people to think similarly to Reynolds in [ that time frame? \,
I'm gonna -- I'll rephrase my question. \,Okay. |,
"You just testified a few minutes ago that it | was reasonable that R.J. Reynolds did not expect those cigarette products that we've just listed that they j designed, manufactured and sold in the '60s and '70s to = deliver quantities of carcinogens in sufficient quantity i to cause lung cancer, correct?","Yes, because they did not know if it could. I i mean, I did say that, but -- yes.",
So my question is -- !,Okay. !,
"-- was it reasonable for the consuming public \ who purchased and used those cigarette products in the \ 1960s and '70s also not to expect that the use of those products would cause them to be exposed to carcinogens in sufficient quantities to develop lung cancer and 25 other fatal diseases? United Reporting, Inc. Source: https://www.industrydocuments.ucsf.edu/docs/rspw0221","I don't know whether it would have been reasonable or not for them. Certainly, I'm sure certain people would have thought that or could have thought that. j \2 oo it was reasonaoie tor K,.ij * rveynoicts nor LO expect it, but you're not sure if it was reasonable for the consuming public to expect it?",
"So I just want to be clear, though: You think it's reasonable that R.J. Reynolds did not expect their cigarette products to expose the users of those cigarette products to carcinogens in sufficient quantities such that it would cause it could cause lung cancer and other fatal diseases in the 1960s and '70s, but it would not be reasonable for the consuming public to have the same expectation?",,
"You just testified that R.J. Reynolds Tobacco | United Reporting, Inc. Source: https://www.industrydocuments.ucsf.edu/docs/rspw0221 http://J_c.L-IlLfcii.~~ Page 107 I Company did not expect that the use of those cigarette j products in the 1960s and '70s would that those j cigarette products could deliver quantities of carcinogens in sufficient quantity to cause lung cancer f CJL I 1 \Ji v J L- 1 1 vl* -L. J~ C I L . C I JL \J. JL. O KHZ CL O KHH* O f V-*- VM^ -L 1 - KHZ v** L-> C;","Correct, f",
"I'm asking you, is it your testimony that the j consuming public -- it will be reasonable for the I consuming public to have that same expectation as R.J. Reynolds in that time frame? f","If they knew about the delivery of carcinogens f in significant quantity, would it be reasonable for f them? No, they could share Reynolds' opinion or they | could share Reynolds' position on that. With regard to f carcinogens, I don't know that that was well known. j That's -- that's the reason I'm saying. Is because f you're saying the products were designed was to deliver carcinogens in sufficient quantity to account for lung cancer, that's the part that I'm saying Reynolds j didn't -- wouldn't have known, so it wouldn't have been z unreasonable, ana so but I don t nave any idea about 3 w h a t t h e g e n e r a l public might have known about that \ I specific type of question. Do you understand where I'm why I'm being a j United Reporting, Inc. Source: https://www.industrydocuments.ucsf.edu/docs/rspw0221 l i t t 1 p l"")it"" irPssfiTrvfid in t s r m s of",
"Yeah, I unders tand.",Okay .,
So it's not your testimony that it would be unreasonable for the public to have had the same expectation as R.J. Reynolds did regarding whether or not chronic use of those cigarette products that we've listed in the 1960s and '70s would expose the user to quantities of carcinogens sufficient to cause lung cancer and other fatal diseases?,,
