question,answer,Declarative_Text
"Has R.J, Reynolds hired public relations i firms, focus groups and the like to address how to handle social acceptability of smoking",,
-- of cigarettes?,"Again, I have no idea.",
Do you know if R.J. Reynolds has conducted \ focus groups on that matter? j,"On social acceptability of smoking, I don't [ know. I'm not -- that's not an area that I'm pre that I prepared under. \",
Okay. Has R.J. Reynolds discussed using the ideal of choice to affect social acceptability of \ smoking? \,I don't know. \,
Okay. Has R.J. Reynolds used the ideal of ( pleasure in connection with smoking to affect the social J acceptability of smoking?,"Again, I don't know anything about social \ ZD accept a d 11 r y anci wnar wouict wnat. was cione or it en Ol United Reporting, Inc. 0) Source: https://www.industrydocuments.ucsf.edu/docs/rspw0221 anything was done around that topic. y ^ g / J L O l l L - X L L * . 1 * L X \ Z L * 1 1 C L L * \ Z Z V v ^ - L y L / X ^ v J v * i L * V # * U L * 1 1 0 . L - l . \ L r Reynolds sells is addictive?",
Okay. So it's your testimony that Reynolds [ has actively tried to reduce the level of nicotine in j their cigarettes? [,"Not only tried, they did, both reduce the tar and the nicotine in their products over time. \",
"All right. You remember the Cohen deposition \ you gave for a case pending in West Palm Beach, Florida? \",Not specifically. I know the name. \,
"Okay. And it's Cohen versus R.J. Reynolds j Tobacco Company, December 19th, 2012, is the date of your deposition, okay. Were you asked this answer -- this question \ and did you give this answer: So if that's the case, j why are you guys trying so hard to make products with j en eo en en United Reporting, Inc. Source: https://www.industrydocuments.ucsf.edu/docs/rspw0221 very low nicotine yields? Answer: I wouldn't say that we are been trying to do is make very low tar yielding products. Part of that, when you lower the tar associated in combustible products, you will also lower the nicotine. I mean, by the same token there have been a lot of efforts to try and change the target nicotine ratio as well, which we've attempted to do, but from a commercial aspect have not been successful. So when you were asked, why are you trying so hard well, you were asked that question, you gave that answer, correct?",Perhaps. I mean,
Would you like to see it?,"I would love to see it, thank you.",
Sure.,Because I'd like to see the contextual parts of the question.,
Let me mark it so you'll know what I'm talking about. And I'm referring to Page 168 starting on Line 3.,Okay. ft w ' xenoers document. t.o witness /,
So if that's -- [,So I don't have any issues with my with my answers. [,
"So if that's the case, why are you guys trying j so hard to make products with very low nicotine yields? | Answer: I wouldn't say that we necessarily | are trying to. j So when you were asked: Why are you trying to j make low yielding nicotine cigarettes, your answer was, United Reporting, Inc. Source: https://www.industrydocuments.ucsf.edu/docs/rspw0221 Page 167 I We aren't necessarily trying to, correct? \","Correct. Because what we're trying to do is address the potential association between smoking and j disease, nicotine doesn't cause disease. Okay. It's j the toxicants in smoke that do. And when you lower tar, you lower toxicants. And potentially if you lower [ toxicants, you might reduce disease. So that's why we f do that. But the consequence is you're also lowering \ nicotine.",
"But your answer was very clearly, that's not \ what you were necessarily trying to do --",,
-- correct? \ JT\ JL 11 **-A vZ- X1 s3T JL CI -X- f L 11 CI l_ o v* \*J JL- JL vH \-# L* # X KJ Ll X \* L* X. V JL 11 -J L v J > lower tar.,,
"You haven't tried to eliminate addiction from | your cigarette products, correct?","Not to my knowledge, no. j",
"And you know that it's been reported in your own business records that nicotine is the primary reason people smoke, correct? j",I don't know what you mean by that.,
"Okay. You've never seen in your own business f en CO Oi o United Reporting, Inc. Source: https://www.industrydocuments.ucsf.edu/docs/rspw0221 records statements from R.J. Reynolds' scientists stating that nicotine is the primary reason people smoke?",I have seen a couple references from one person in particular is what I can think of.,
And is it R.J. Reynolds' position that it is the taste of a cigarette that creates chronic repetitive use as opposed to the nicotine in the cigarette?,"Is it the -- I'm sorry, I don't understand what you mean.",
Is it R.J. Reynolds' position that it is the taste of the cigarette that compels chronic repetitive use as opposed to the nicotine in the cigarette?,"I, my -- I think taste can certainly have something to do with that, yes. Certainly nicotine can have something to do with that. I think it's a complicated scenario.",
But it's R.J. Reynolds' position is that taste has more to do with chronic repetitive use than nicotine?,"I did not say that, no.",
"So nicotine has more to do with chronic competitive -- chronic repetitive use of cigarettes than < \J \*> CI O L si* LA \J t- O * en GO United Reporting, Inc. Source: https://www.industrydocuments.ucsf.edu/docs/rspw0221 r\",,
"And that would have been true back in the 1960s, 1970s?","That would not have been our position in the 1960s, no.",
"Okay. Looking back now, is it -- would you j agree that that was true back then in the 1960s, that cigarette smoking was the number one cause of the \ development of lung cancer?","From today's point of view, I would say j probably so, yes.",
"And would you agree that that would have been j true in the 1970s, that cigarette smoking was the number \ one cause of lung cancer?","With today's knowledge, looking backwards, is \ that what you're asking me?",
I'm asking you just to answer my question.,"That was not Reynolds' position in the '70s, j no.",
But you would agree that -- that based on what I you know that is the case? j,"I would say in general that would probably be the case with today's knowledge, but that was not [ Reynolds1 position in the '70s. \ United Reporting, Inc. oi -si CJI co Source: https://www.industrydocuments.ucsf.edu/docs/rspw0221",
"And in the 1980s cigarette smoking was the number one cause of lung cancer, correct?","With today's knowledge, I would say yes, but that was not Reynolds' position in the '80s.",
In the 1990s cigarette smoking was the number,Correct.,
"Cigarette smoking -- nicotine addiction is caused -- is caused through cigarette smoking, correct?","I don't no, I would not agree with that.",
You do not agree that a cigarette smoker develops addiction to nicotine through cigarette smoking?,"A cigarette smoker certainly could, yes.",
"So cigarette smoking is a cause of nicotine addiction, correct?","I would say potentially, yes. - f i r j f j _ . ^",
"And if that is their only source of any measurable amount of nicotine -- strike that. If somebody is addicted to nicotine and cigarette smoking is the only measurable source of nicotine to them, that would be the only source that would be contributing to their nicotine addiction, correct? 4*. Ol United Reporting, Inc. Source: https://www.industrydocuments.ucsf.edu/docs/rspw0221","I would have to agree with the logic of that, yes, if that person were addicted.",
You have considered yourself to be addicted to,I don't know that I have or have not.,
you've never testified that you you may be addicted to nicotine?,"Oh, I think I have testified that I may be, but I've never tested myself to determine whether or not I'm addicted to nicotine.",
How would you do that?,I don't exactly know. I know there are some surveys that one can take -- some certain tests that one | could run but I have not done them.,
"And, like, for example, what would that be?",Like -- I'm trying to remember the name of the --,
Fagerstrom?,"Yeah. That's a test. There's many others, but Fagerstrom is one of the --",
One of the tests,,
"One of the tests to determine addiction? WMWHHSBWSWMWSfflWg CD United Reporting, Inc. Source: https://www.industrydocuments.ucsf.edu/docs/rspw0221","I think in general it is. And, again, it's -- the test is on the person, of course, not on the products.",
"The product is the is the addictive product, though, correct?","Well, again, it's -- the test is run on the person and that is how it's determined. You can't make that determination on the product.",
But you don't need to run --,You can't run -- you can't run Fagerstrom on a CXUui BLLc,
Right. But you don't have to run Fagerstrom on a cigarette to know that a cigarette can be *JL w CX \JL v* -1 v** L~ -I* V Sw f N** \J JL. JL U *w L* *,I don't. I believe that it's feasible.,
"And you still get cravings for cigarettes, don't you?","I don't know, from time to time, perhaps. Yeah, I miss smoking from time to time.",
"You would agree that chronic use of nicotine through cigarettes chemically changes the brain, { oi CO on correct? WMWJW!WMM\^TOWMMWM^^ United Reporting, Inc. Source: https://www.industrydocuments.ucsf.edu/docs/rspw0221","I don't know, I'm not an expert in that area. anything that one ingests in the body I think potentially affects the brain and does.",
"Getting back to the Cohen deposition, were you asked this question and did you give this answer: Do you agree that when you smoke, the nicotine actually changes the brain, that's why quitting is so hard? Answer: You know, I'm not that -- I'm not that familiar with the kind of scientific information. I do understand that nicotine can, does go to the brain and there are receptors, nicotinic receptors that changes the brain, you know, I don't know. From a chemistry standpoint, sure, I would say yes. But, again, eating food changes the brain as well, so, you know, I'm not really sure that I know what that means necessarily. iy but in looKing at your answer, you saiQ were you asked that question and did you give that answer?","Yeah, I think that sounds like the answer I gave and it sounds similar to the answer I just gave you, I think. So I would stand by that answer.",
"Right. You said from a chemistry standpoint, WWWWWM'WHW!MlTO>fflffll?!W?IW United Reporting, Inc. Source: https://www.industrydocuments.ucsf.edu/docs/rspw0221 sure, I would say yes.",,
"I Qidn t say that s all you said. But that is part of your answer, correct?","It is part of my answer, correct.",
"Right. Part of the answer to the question: Do you agree that when you smoke, the nicotine actually changes the brain, that's why quitting is so hard? Part or your answer was, rroin a cnemisury standpoint., sure, i would say yes.","Again, I can -- I would rest by my whole answer on that.",
"Okay. But my question is from a chemis from a chemistry standpoint, you would agree with that statement that nicotine changes the brain, that's why quitting is so hard?","I don't know that that's necessarily the case. I know that nicotine when it goes into the brain can -- there are changes that occur, so I agree with that. But ummmmmmmmmmmmmmmmmmmmmmmmmm g O l Cx> United Reporting, Inc. Source: https://www.industrydocuments.ucsf.edu/docs/rspw0221 I don't know that's why quitting is so hard.",
"Okay. Well, that --","Okay, So I can't -- I'm sorry, but I've got to separate the two. So when I say from a chemistry perspective, yes, it changes the brain, that's the part I know. Whether or not that's connected to making it harder to quit, that I don't know.",
"But you didn't -- you didn't separate the two in your answer that you gave, correct?","Well, I'm sorry, but I kind of did because I explained my answer.",
"Where did you say in your answer that I'm ~~ from a chemistry standpoint, sure, I would say, yes, but I don't mean that as to whether -- as to why that's so -- makes it so hard to quit?","Bingo, right there.",
"No, you didn't say that. I'm asking you, where in your answer do you say that?","Well, if you read the rest of my answer again I think it explains it. So, I mean, if you read the whole answer, I think it puts it into context. I would say that I don't know that those are all the -- that I don't have that information. So if you read I mean, ""^WJWfWWWWWPWWWW^^ en CO N en O) United Reporting, Inc. Source: https://www.industrydocuments.ucsf.edu/docs/rspw0221 I can't -- I don't have a photographic memory, but if you just read the answer, I think it speaks for itself. J Q So from what you re saying at least from what you're saying, at least today, you're saying that you agree that chronic use of nicotine changes the brain?",
And when Reynolds designed their cigarettes including the list of cigarettes that we had gone through already in this deposition back in the 1960s and intention that chronic use of those cigarettes would cause changes in a smoker's brain?,No.,
is pure nicotine cytotoxic?,"I mean, anything is cytotoxic depending on would say probably, yes, at certain concentrations it could be.",
When did you acquire that knowledge?,When did I acquire --,
"When did you acquire the knowledge that United Reporting, Inc. vj Source: https://www.industrydocuments.ucsf.edu/docs/rspw0221 ~i nicotine A Q 2013? A Q A Q t \ Q is cytotoxic, period? j",,
"Sure, let's read it again.",I certainly make that suggestion. |,
"I wouldn't say that Reynolds doesn't know, I'm [ saying I don't know.",Uh-huh.,
"It may very well be in the literature, I don't \ know as -- I'm sorry. Print is too small for me. Okay. Here we go: Does Reynolds consider nicotine to be cytotoxic? Answer: Pure nicotine? I don't know that we have a -- I don't know that we have a position on j that. I'm trying to think if it is if it is \ cytotoxic. It -- I don't know that it is or it isn't, \ I don't know that we've tested pure nicotine or not in j terms of cytotoxicity. [ So where did you say in there that it might j be? |","Doesn't that say that? If I say, I don't know \ if it is or it isn't, doesn't that mean that it might j DG. i mean, i tniriK it ~* i L n I n K it does.",
You're saying that you've never looked into it [ and you don't know?,,
"Nowhere in your answer did you say that you ijMWWW^W^WWHiWMW}W!M^ United Reporting, Inc. Source: https://www.industrydocuments.ucsf.edu/docs/rspw0221 i naci a oasis to suggests. ""c.nat i~c ruigriti. DG^ correc""C.",,
"Starting at Page 70, Line 21, you tell me where you said you have a basis to suggest that it might be.","I'm sorry, which line?",
"Page 70, Line 21.","(Witness perusing document.) I say, I don't know that it is or isn't, that certainly leaves the possibility that it rnight be and that's what my answer would say. I said, I don't know if it is or it isn't. I don't know that we've tested pure nicotine or not in terms of cytotoxicity. That was partially -- my whole answer again is, pure nicotine question. I don't know that we have a -- I don't know that we have a position on that. I'm trying to think if it is -- if it -- if it is cytotoxic. I don't know that it is or it isn't. I don't know that we've tested pure nicotine or not in terms of cytotoxicity.",
"What has Reynolds done -- okay. SjBftBBiSWBffiBffBWB1^^ Ol United Reporting, Inc. Source: https://www.industrydocuments.ucsf.edu/docs/rspw0221 not nicotine is or is not cytotoxic? \","Pure nicotine, I don't know that we've run a f cytotoxicity test on it. |",
"So Reynolds doesn't know because they haven't [ looked, correct? j","I don't -- again, I don't know that we have or \ have not looked. Okay. I don't know as I'm sitting j here. All I know is what I know about cytotoxicity f testing, is that most things can be cytotoxic given the concentration. So nicotine might very well be cytotoxic \ depending on the concentration, which is the first | answer I think I gave you when you asked me that \ question. \",
What is cytotoxicity?,It's basically cell death.,
What is genotoxicity?,"It causes gene disruption, gene mutations. j",
"So a substance that can cause either j cytotoxicity or genotoxicity, cell death or gene death, | could be dangerous to the user, correct? \","Again, possibly. But it's all based on a relative oasis oecause just SDOUL anytning can oe cytotoxic and genotoxic, but, yes, that's a possibility, j That's what the tests are meant to do -- | United Reporting, Inc. Oi Ul Source: https://www.industrydocuments.ucsf.edu/docs/rspw0221 Page 184 j",
A n d -- j,is try to make those determinations. [,
I'm sorry to interrupt you. What has Reynolds | done to determine the cytotoxicity or the genotoxicity j of nicotine in their cigarette products?,"In their cigarette products, it's neither \ genotoxic or cytotoxic as far as I know because the \ concentration is quite low. \",
What has -- okay. \,And the j,
What has Reynolds done to determine if the nicotine in their cigarette products is either cytotoxic j or genotoxic? \,That would be not really easy to determine in j cigarette products. What I can say with regard to | nicotine on those measures is that nicotine is neither j considered -- is not considered to be a health hazard by | everybody in the public health community with regard to | those as a pure compound. [,
"My question is, what has Reynolds done to | determine if nicotine in their cigarette products is \ cytotoxic or genotoxic? [ United Reporting, Inc. Source: https://www.industrydocuments.ucsf.edu/docs/rspw0221","I don't know that we've we've not done anything because it's not been necessary to do, it's not | a health concern, so we wouldn't have done that with regard to nicotine.",
"And what has -- well, you -- what has Reynolds done to determine if nicotine is cytotoxic or genotoxic?","Nothing that I'm aware of, because it's not a health issue.",
"Okay. Well, you've already testified that you don't know if nicotine is or isn't cytotoxic, correct?",Correct.,
"And you are -- you don't know if nicotine is or isn't genotoxic, correct?",Correct.,
"And Reynolds doesn't know it either, correct?",,
"Okay. I'll rephrase the question. Reynolds doesn't know if nicotine is either genotoxic or cytotoxic, correct?",I don't know that Reynolds doesn't know that. I know -- I don't know that.,
"But you've -- you've decided that it's not necessary for you to know that for you to be able to say CO United Reporting, Inc. Source: https://www.industrydocuments.ucsf.edu/docs/rspw0221 that nicotine has no deleterious effects? j","I mean, that's known in the public health community, so i uon L understand wny unat s nor, rairiy \ common knowledge. j",
"Reynolds in certain states is required to reveal or disclose nicotine yields in their cigarette products, correct?",Did you say in certain states?,
Certain states.,"I -- I don't know. I know we I know we submit information to certain states, certainly we submit information to the FDA as well, which would be I ail SL3. LcS .",
"For example, Reynolds is required to submit their nicotine yield information to the Massachussets c*u ueparLmeni. or rieaiLn, correct,,",They have. And I believe to Minnesota and Texas as well.,
"Right. And you're aware that the Massachussets Tobacco Control Program analyzed the data provided by the various cigarette manufacturers *WWfflSWJvWW.l)JUlM^ X e n United Reporting, Inc. C*> 954.525-2221 Source: https://www.industrydocuments.ucsf.edu/docs/rspw0221 including Reynolds between 1998 and 2004 pertaining to cigarette products, correct?",Analyzed?,
"All right. And the Massachussets Department o""f H P* <-} 1 t"" h T*- n 3 <=!'t""'nri\/ T*^l^1~^ri! *t~o t""Vio n l rnt - i n p v i p 1 rl i n brands that were produced by the various manufacturers, one of which was R.J. Reynolds, correct?","I would presume so, yes.",
"Okay. And you know that they ran a study and then produced the results of that study in 2004, correct?",I believe that's the correct time frame.,
"And Massachussets Department of Health analyzed, and from their testing methods, the nicotine z/L yields or approximately iio uirzerenr cigarec.ce cranes, correct?","I'm sorry, their testing methods? I don't I w I GO know what you mean. \ -* Ol United Reporting, Inc. Source: https://www.industrydocuments.ucsf.edu/docs/rspw0221 http://cigarec.ce",
Did,"We submitted the data to Massachussets, so it was not their testing methods to my understanding.",
You're you're,It was our test.,
Okay. Massachussets it's your position that Massachussets did not run their own tests regarding nicotine yield?,I don't know if they did or did not. I know that we submitted our test data to Massachussets.,
"Okay. Are you aware of the report, Massachussets Department of Health Changes in Nicotine JL **/ X JL % JL \JL O f JL Z? jf O L-* w ^ U U T","I think I'm generally aware of it, although I don't remember preparing for that for this deposition.",
I'm asking you if you're aware of it.,I am aware.,
"Okay. And you're aware that they tested, themselves, nicotine yields of 116 brands of cigarettes",,
correct?,"I'm I don't know the specifics of it. I do know that they looked at our data. I don't know if they bought 116 different cigarette brands and had them i * I en United Reporting, Inc. Ui Source: https://www.industrydocuments.ucsf.edu/docs/rspw0221 tested or not. I just don't know I don't remember the specifics of that article.",
All right. Regardless of --,"If you would like me to read it, I'll be happy to read it and go through it.",
"Sure. Sure. Just give me a second, though. Well, regardless of the method that they came up with their results, you understand that the results they came 9 up with showed an increase in nicotine yield from to 2004, correct?",,
So the Massachussets Department of Health is silly?,"That statement is in my opinion, yes. Because manufacturing variability and year-to-year crop variability is going to be greater than the amount that WMWMWm<mJUW)^ Oi CO United Reporting, Inc. 0> Source: https://www.industrydocuments.ucsf.edu/docs/rspw0221 they reported they saw an increase in, and I know that. |",
They looked at R.J. Reynolds brands in the,"I would presume they did, yes.",
"You know they did, right?","I think they did, yes.",
"And you know they looked at Doral Menthol and Doral Menthol Lights, correct?","i aon x Know tne speciiics, DUX, I presume tiist s ~~ tnat s reasiD-Le . 0 Okav. And as a result of their studv from 1998 to 2004, isn't it true that the Doral Menthol Lights showed an increase of 36 percent in nicotine yield?",
52 this is I'll read from a portion of the report.,Uh-huh.,
"52 of the 116 sub-brands had increases in nicotine yields above 10 percent for the seven-year period. Analysis revealed that RJR's Doral brand had the largest percent increase, 36 percent in nicotine i CO I Ol United Reporting, Inc. Source: https://www.industrydocuments.ucsf.edu/docs/rspw0221 yield, from 1998 to 2004. So the accumulated increase over the years was S p * */ V K r V H # X * V w C * ir t *mf f > "" * V "" ^ A w J L W W - W","That's what they said. I can I can certainly tell you that manufacturing variability on nicotine is about 20 percent. So we're no better from a manufacturing standpoint on nicotine yields than about 20 percent. So, again, with crop-to-crop year variability added into that, 36 percent is not a very large change so",
You're saying that,"what I'm saying is, there is no major increase with nicotine for that particular brand.",
"You're saying that an inc- a nicotine yield increase from 1998 to 2004 by 36 percent is not a ..L. YJ 3 JL, V* X1 Am -L. A \m# G 1 1 L -L i 1 \_* X. vU CX O \H7","Right. When I'm when I'm telling you that J., O ITlcLil Li IZ^OlLLJX^XIlCr v Q. XTXolJ-L-LlL.y I S \J TJ G JT C n ^ Oil Xl.na.Xl particular number, nicotine, as measured in smoke, then I would say that chops that down to about 16 percent and I can tell you from crop-to-crop year, you will have a fairly large change depending on the weather conditions that also needs to get added into that. So that's part of the issue.",
"But you're not disputing that the result of ^umiwwMmimam<^ I Ol United Reporting, Inc. Source: https://www.industrydocuments.ucsf.edu/docs/rspw0221 http://Xl.na.Xl their study was that there was a 36 percent increase in nicotine yield between 1998 and 2004?","I'm not necessarily disputing it, no. I mean, if you'd like me to I'd read the I could go ahead and read the article.",
Sure. (Tenders document to witness.),(Witness perusing document.) Is this the published article? Where was this published? I thought I was looking at the published article that they wrote.,
I thought you were prepared. You know what you,"Well, I'm not prepared because you didn't submit it.",
"Here. I thought you wanted to look at it. I mean, that's what I thought you said.","Oh, no, I'm sorry. I thought I thought I was looking at the I thought I was looking at a reprint of the published article. This doesn't look like it was published. Do you understand what I'm saying? In what journal, what peer-reviewed journal did like a -- it doesn't look like that.",
This is from -- you can pull this off the Massachussets website. You can pull this off,"Okay. So this just came off the website. I Ol ""mmmmmmmmmmmm i-CTWMiJiWWHWWi-i-W^-H-WWiUMH WKWKWtW United Reporting, Inc. CO Source: https://www.industrydocuments.ucsf.edu/docs/rspw0221 thought we were talking about a peer-reviewed article, z LJ13L S wnati. i tmougnu we were taiKing aDOUL.",
"Okay. But we're talking about the Massachussets study. You're familiar with that, from 1998 that analyzed nicotine --","Well, maybe I'm only familiar with a -- with a with a news headline, then. I thought it was a peer-reviewed article, I may be wrong. Maybe it was just something they put on their website.",
You're talking about the Harvard study by Greg Connolly?,Right. That's what I thought -- that's what I thought we were talking about.,
"Well, that's a different study. We're going to talk about that one in a second, but this is the Massachussets study --","Well, I haven't read this.",
from 1998 to 2004.,"Well, I presume this is the same data.",
